{
  "id": "CHEBI:15361",
  "nombre": {
    "es": null,
    "en": "example compound (fictitious)"
  },
  "definicion": null,
  "sinonimos": [],
  "formula": "C3H3O3",
  "carga": -1,
  "masa_monoisotopica": 87.0,
  "smiles": "C",
  "inchi": null,
  "inchikey": "AAAAAAAAAAAAAA-AAAAAAAAAA-A",
  "clase": "otro",
  "es_cofactor": false,
  "xrefs": [],
  "procedencia": []
}
